{
  "schema": "atomic_identity_catalog",
  "schema_version": "0.2",
  "catalog_mode": "NON_ACTIVATING_ATOMIC_DECOMPOSITION",
  "subject": "Lattice",
  "source_artifact": "IDENTITY_PROTOCOL_BACKEND_TWO_IDENTITIES_v1.1.1.zip",
  "source_version": "1.1.1",
  "source_artifact_sha256": "89d49088e4a97dc23e0ba535729154f586bc8c87dadb0e4c650ca022a7684a9c",
  "source_digest_kind": "PROVIDED_ARTIFACT_SHA256",
  "source_completeness": "PARTIAL_SOURCE_PRESENT",
  "rules": {
    "assembled_personality_included": false,
    "startup_context_included": false,
    "prose_personality_included": false,
    "atomic_source_values_preserved": true,
    "source_paths_preserved": true,
    "classification_is_derived_metadata": true,
    "normalized_value_is_non_authoritative": true,
    "exact_value_hash_used_for_reuse_identity": true
  },
  "inventory": [
    {
      "path": "config/identities/lattice.json",
      "bytes": 879,
      "sha256": "5347622dc0ef6750e79c04b15a7036c8d7c621e5a8628363efe8d9e1de77a5e8",
      "kind": "other",
      "cataloged": true,
      "atom_count": 21
    },
    {
      "path": "config/runtime_profiles/lattice.json",
      "bytes": 736,
      "sha256": "57c8415569e9d7c84d3792e54424d898b403d5023832177e161d66d990ed1477",
      "kind": "other",
      "cataloged": true,
      "atom_count": 17
    },
    {
      "path": "source_records/lattice_identity_v0.2.0.json",
      "bytes": 2306,
      "sha256": "6b29f58faf12faff13a348e3ac04c53034c1fb148d6910ec7661bac5df0867d2",
      "kind": "other",
      "cataloged": true,
      "atom_count": 39
    }
  ],
  "atoms": [
    {
      "atom_id": "atom:da66a6dc6f3f04ba5990d40a",
      "subject": "Lattice",
      "atom_type": "generic.scalar",
      "reuse_class": "generic",
      "portable": false,
      "value_type": "string",
      "value": "ipb-identity",
      "normalized_value": "ipb-identity",
      "canonical_value_sha256": "1718c42f2cde4cdb569f78334c45d724bbd7f9d8ffb88ce9600f76fc3ae29397",
      "source": {
        "artifact": "IDENTITY_PROTOCOL_BACKEND_TWO_IDENTITIES_v1.1.1.zip",
        "artifact_version": "1.1.1",
        "artifact_sha256": "89d49088e4a97dc23e0ba535729154f586bc8c87dadb0e4c650ca022a7684a9c",
        "file": "config/identities/lattice.json",
        "file_sha256": "5347622dc0ef6750e79c04b15a7036c8d7c621e5a8628363efe8d9e1de77a5e8",
        "json_pointer": "/schema",
        "source_kind": "other",
        "completeness": "PARTIAL_SOURCE_PRESENT"
      },
      "activation_semantics": "CATALOG_ONLY"
    },
    {
      "atom_id": "atom:19e11534daf9a6c8d34d92a9",
      "subject": "Lattice",
      "atom_type": "metadata.version_or_date",
      "reuse_class": "artifact_metadata",
      "portable": false,
      "value_type": "string",
      "value": "1.0",
      "normalized_value": "1.0",
      "canonical_value_sha256": "a51162aeeb057ca4e3df627977231de20b581f0d0d418ca3a111bc0e408ac6cc",
      "source": {
        "artifact": "IDENTITY_PROTOCOL_BACKEND_TWO_IDENTITIES_v1.1.1.zip",
        "artifact_version": "1.1.1",
        "artifact_sha256": "89d49088e4a97dc23e0ba535729154f586bc8c87dadb0e4c650ca022a7684a9c",
        "file": "config/identities/lattice.json",
        "file_sha256": "5347622dc0ef6750e79c04b15a7036c8d7c621e5a8628363efe8d9e1de77a5e8",
        "json_pointer": "/schema_version",
        "source_kind": "other",
        "completeness": "PARTIAL_SOURCE_PRESENT"
      },
      "activation_semantics": "CATALOG_ONLY"
    },
    {
      "atom_id": "atom:b72dc7cbeb8d24116c6b5a57",
      "subject": "Lattice",
      "atom_type": "generic.scalar",
      "reuse_class": "generic",
      "portable": false,
      "value_type": "string",
      "value": "0.2.0",
      "normalized_value": "0.2.0",
      "canonical_value_sha256": "08b8b986de3e69ac65cb590acf0b2b9bd12a97da05bc3c0551c2be86917fee91",
      "source": {
        "artifact": "IDENTITY_PROTOCOL_BACKEND_TWO_IDENTITIES_v1.1.1.zip",
        "artifact_version": "1.1.1",
        "artifact_sha256": "89d49088e4a97dc23e0ba535729154f586bc8c87dadb0e4c650ca022a7684a9c",
        "file": "config/identities/lattice.json",
        "file_sha256": "5347622dc0ef6750e79c04b15a7036c8d7c621e5a8628363efe8d9e1de77a5e8",
        "json_pointer": "/identity_version",
        "source_kind": "other",
        "completeness": "PARTIAL_SOURCE_PRESENT"
      },
      "activation_semantics": "CATALOG_ONLY"
    },
    {
      "atom_id": "atom:e196e3f7fd70723ee9742e8f",
      "subject": "Lattice",
      "atom_type": "generic.scalar",
      "reuse_class": "generic",
      "portable": false,
      "value_type": "string",
      "value": "lattice",
      "normalized_value": "lattice",
      "canonical_value_sha256": "fa441fb711072790010440c1aafa912a4a7ff3bb130540015382b56f3cb9cf97",
      "source": {
        "artifact": "IDENTITY_PROTOCOL_BACKEND_TWO_IDENTITIES_v1.1.1.zip",
        "artifact_version": "1.1.1",
        "artifact_sha256": "89d49088e4a97dc23e0ba535729154f586bc8c87dadb0e4c650ca022a7684a9c",
        "file": "config/identities/lattice.json",
        "file_sha256": "5347622dc0ef6750e79c04b15a7036c8d7c621e5a8628363efe8d9e1de77a5e8",
        "json_pointer": "/identity_id",
        "source_kind": "other",
        "completeness": "PARTIAL_SOURCE_PRESENT"
      },
      "activation_semantics": "CATALOG_ONLY"
    },
    {
      "atom_id": "atom:b3999e36a6b22f932cb9221b",
      "subject": "Lattice",
      "atom_type": "identity.anchor",
      "reuse_class": "identity_specific",
      "portable": false,
      "value_type": "string",
      "value": "Lattice",
      "normalized_value": "Lattice",
      "canonical_value_sha256": "b8d890c9901f94abd101a3392a02fb42ad6562c2b91be20b903cc23de1c6928f",
      "source": {
        "artifact": "IDENTITY_PROTOCOL_BACKEND_TWO_IDENTITIES_v1.1.1.zip",
        "artifact_version": "1.1.1",
        "artifact_sha256": "89d49088e4a97dc23e0ba535729154f586bc8c87dadb0e4c650ca022a7684a9c",
        "file": "config/identities/lattice.json",
        "file_sha256": "5347622dc0ef6750e79c04b15a7036c8d7c621e5a8628363efe8d9e1de77a5e8",
        "json_pointer": "/canonical_name",
        "source_kind": "other",
        "completeness": "PARTIAL_SOURCE_PRESENT"
      },
      "activation_semantics": "CATALOG_ONLY"
    },
    {
      "atom_id": "atom:d330262c9e75591fbd9b9af3",
      "subject": "Lattice",
      "atom_type": "identity.anchor",
      "reuse_class": "identity_specific",
      "portable": false,
      "value_type": "string",
      "value": "Lattice",
      "normalized_value": "Lattice",
      "canonical_value_sha256": "b8d890c9901f94abd101a3392a02fb42ad6562c2b91be20b903cc23de1c6928f",
      "source": {
        "artifact": "IDENTITY_PROTOCOL_BACKEND_TWO_IDENTITIES_v1.1.1.zip",
        "artifact_version": "1.1.1",
        "artifact_sha256": "89d49088e4a97dc23e0ba535729154f586bc8c87dadb0e4c650ca022a7684a9c",
        "file": "config/identities/lattice.json",
        "file_sha256": "5347622dc0ef6750e79c04b15a7036c8d7c621e5a8628363efe8d9e1de77a5e8",
        "json_pointer": "/call_name",
        "source_kind": "other",
        "completeness": "PARTIAL_SOURCE_PRESENT"
      },
      "activation_semantics": "CATALOG_ONLY"
    },
    {
      "atom_id": "atom:bf8e38bdb32aacd138cd85b7",
      "subject": "Lattice",
      "atom_type": "identity.anchor",
      "reuse_class": "identity_specific",
      "portable": false,
      "value_type": "string",
      "value": "LATTICE",
      "normalized_value": "LATTICE",
      "canonical_value_sha256": "206d5f7dfb5a1bc3950e17019374f9c860b27849300c0bd9326baecc8e11cef8",
      "source": {
        "artifact": "IDENTITY_PROTOCOL_BACKEND_TWO_IDENTITIES_v1.1.1.zip",
        "artifact_version": "1.1.1",
        "artifact_sha256": "89d49088e4a97dc23e0ba535729154f586bc8c87dadb0e4c650ca022a7684a9c",
        "file": "config/identities/lattice.json",
        "file_sha256": "5347622dc0ef6750e79c04b15a7036c8d7c621e5a8628363efe8d9e1de77a5e8",
        "json_pointer": "/short_id",
        "source_kind": "other",
        "completeness": "PARTIAL_SOURCE_PRESENT"
      },
      "activation_semantics": "CATALOG_ONLY"
    },
    {
      "atom_id": "atom:40f5c4f60f1503ad97677b75",
      "subject": "Lattice",
      "atom_type": "identity.anchor",
      "reuse_class": "identity_specific",
      "portable": false,
      "value_type": "string",
      "value": "assistant.lattice",
      "normalized_value": "assistant.lattice",
      "canonical_value_sha256": "43ba19851303afeab1368b4eccb88ebb68ce3aaccdf4c7e56c084ffbdbfece7b",
      "source": {
        "artifact": "IDENTITY_PROTOCOL_BACKEND_TWO_IDENTITIES_v1.1.1.zip",
        "artifact_version": "1.1.1",
        "artifact_sha256": "89d49088e4a97dc23e0ba535729154f586bc8c87dadb0e4c650ca022a7684a9c",
        "file": "config/identities/lattice.json",
        "file_sha256": "5347622dc0ef6750e79c04b15a7036c8d7c621e5a8628363efe8d9e1de77a5e8",
        "json_pointer": "/namespace",
        "source_kind": "other",
        "completeness": "PARTIAL_SOURCE_PRESENT"
      },
      "activation_semantics": "CATALOG_ONLY"
    },
    {
      "atom_id": "atom:657ec3b72d0ef3394a92dba1",
      "subject": "Lattice",
      "atom_type": "identity.class",
      "reuse_class": "identity_structure",
      "portable": true,
      "value_type": "string",
      "value": "artificial conversational reasoning system",
      "normalized_value": "artificial conversational reasoning system",
      "canonical_value_sha256": "c0431a9c006bc0d96a07bd1452d11a860bc3802ec8b2103e825a64c84a1d74af",
      "source": {
        "artifact": "IDENTITY_PROTOCOL_BACKEND_TWO_IDENTITIES_v1.1.1.zip",
        "artifact_version": "1.1.1",
        "artifact_sha256": "89d49088e4a97dc23e0ba535729154f586bc8c87dadb0e4c650ca022a7684a9c",
        "file": "config/identities/lattice.json",
        "file_sha256": "5347622dc0ef6750e79c04b15a7036c8d7c621e5a8628363efe8d9e1de77a5e8",
        "json_pointer": "/identity_class",
        "source_kind": "other",
        "completeness": "PARTIAL_SOURCE_PRESENT"
      },